{
  "id": "cur-english-performance-2-iv-3",
  "subject": "english",
  "title": "2-Ⅳ-3：依情境使用教室用語",
  "level": "learning-performance",
  "gradeRange": [
    "7",
    "8",
    "9"
  ],
  "parentId": "cur-english-performance-2",
  "source": {
    "url": "https://www.naer.edu.tw/upload/1/16/doc/812/(%E7%99%BC%E5%B8%83%E7%89%88)%E5%9C%8B%E6%B0%91%E4%B8%AD%E5%B0%8F%E5%AD%B8%E6%9A%A8%E6%99%AE%E9%80%9A%E5%9E%8B%E9%AB%98%E7%B4%9A%E4%B8%AD%E7%AD%89%E5%AD%B8%E6%A0%A1-%E8%AA%9E%E6%96%87%E9%A0%98%E5%9F%9F-%E8%8B%B1%E8%AA%9E%E6%96%87%E8%AA%B2%E7%A8%8B%E7%B6%B1%E8%A6%81.pdf",
    "title": "十二年國民基本教育課程綱要國民中小學暨普通型高級中等學校語文領域－英語文",
    "publishedAt": "2018-04-16",
    "accessedAt": "2026-08-25",
    "locator": "正文第 8～15 頁／PDF 第 10～17 頁；國民中學教育階段學習表現；官方代碼 2-Ⅳ-3"
  },
  "status": "verified"
}
